{
  "atlasVersion": "1.0.0",
  "lastVerified": "2026-09-02",
  "statusVocabulary": [
    "verified",
    "implementation-specific",
    "proposal",
    "experimental",
    "unknown",
    "conflicting"
  ],
  "attributes": [
    { "id": "chain", "label": "Chain", "group": "model" },
    { "id": "unitModel", "label": "Unit or object model", "group": "model" },
    { "id": "fungibleSupport", "label": "Fungible support", "group": "model" },
    { "id": "nonFungibleSupport", "label": "Non-fungible support", "group": "model" },
    { "id": "mutability", "label": "Mutability model", "group": "model" },
    { "id": "stateLocation", "label": "State location", "group": "state" },
    { "id": "dataPlacement", "label": "Data placement", "group": "state" },
    { "id": "transferModel", "label": "Transfer model", "group": "operations" },
    { "id": "utxoCoupling", "label": "UTXO coupling", "group": "state" },
    { "id": "validationAuthority", "label": "Validation authority", "group": "state" },
    { "id": "indexerRequirement", "label": "Indexer requirement", "group": "state" },
    { "id": "naming", "label": "Naming support", "group": "model" },
    { "id": "collections", "label": "Collection support", "group": "model" },
    { "id": "programmability", "label": "Programmability", "group": "operations" },
    { "id": "contentPermanence", "label": "Content permanence", "group": "state" },
    { "id": "confirmationBehavior", "label": "Confirmation and reorg considerations", "group": "lifecycle" },
    { "id": "principalUtxoRisk", "label": "Principal UTXO safety risk", "group": "safety" },
    { "id": "activationStatus", "label": "Activation or deployment status", "group": "lifecycle" },
    { "id": "canonicalSource", "label": "Specification or implementation source", "group": "lifecycle" },
    { "id": "sourceRevision", "label": "Pinned source revision", "group": "lifecycle" }
  ],
  "protocols": [
    {
      "id": "atomicals",
      "name": "Atomicals",
      "family": "atomicals-family",
      "summary": "Digital objects and ARC-20 fungible units defined by the Atomicals envelope rules and applied by an Atomicals validator over full transaction history.",
      "attributes": {
        "chain": { "value": "Bitcoin layer 1, mainnet", "status": "verified", "sourceId": "atomicals-electrumx-1.5.2.0", "sourceRevision": "8df23747835c20230fc8b8097d469e7a1d97c3e0", "verifiedAt": "2026-09-02" },
        "unitModel": { "value": "Atomical objects; ARC-20 makes one unit equal to one coloured satoshi", "status": "verified", "sourceId": "atomicals-electrumx-1.5.2.0", "sourceRevision": "8df23747835c20230fc8b8097d469e7a1d97c3e0", "verifiedAt": "2026-09-02" },
        "fungibleSupport": { "value": "ARC-20 fungible tokens with satoshi-denominated units", "status": "verified", "sourceId": "atomicals-electrumx-1.5.2.0", "sourceRevision": "8df23747835c20230fc8b8097d469e7a1d97c3e0", "verifiedAt": "2026-09-02" },
        "nonFungibleSupport": { "value": "NFTs assigned to specific outputs, with Realm, Subrealm, Container, and Payname objects", "status": "verified", "sourceId": "atomicals-electrumx-1.5.2.0", "sourceRevision": "8df23747835c20230fc8b8097d469e7a1d97c3e0", "verifiedAt": "2026-09-02" },
        "mutability": { "value": "FT rules are fixed at deploy; NFT data can change through the update operation subject to sealing rules", "status": "verified", "sourceId": "atomicals-electrumx-1.5.2.0", "sourceRevision": "8df23747835c20230fc8b8097d469e7a1d97c3e0", "verifiedAt": "2026-09-02" },
        "stateLocation": { "value": "Indexer-computed from complete transaction history; nothing consensus-level carries the state", "status": "verified", "sourceId": "atomicals-electrumx-1.5.2.0", "sourceRevision": "8df23747835c20230fc8b8097d469e7a1d97c3e0", "verifiedAt": "2026-09-02" },
        "dataPlacement": { "value": "Atom operation envelope inside Taproot commit and reveal scripts", "status": "verified", "sourceId": "atomicals-electrumx-1.5.2.0", "sourceRevision": "8df23747835c20230fc8b8097d469e7a1d97c3e0", "verifiedAt": "2026-09-02" },
        "transferModel": { "value": "Spend the carrying UTXO; assignments follow deterministic output index rules", "status": "verified", "sourceId": "atomicals-electrumx-1.5.2.0", "sourceRevision": "8df23747835c20230fc8b8097d469e7a1d97c3e0", "verifiedAt": "2026-09-02" },
        "utxoCoupling": { "value": "Total. Owning the object is owning the carrying UTXO", "status": "verified", "sourceId": "atomicals-electrumx-1.5.2.0", "sourceRevision": "8df23747835c20230fc8b8097d469e7a1d97c3e0", "verifiedAt": "2026-09-02" },
        "validationAuthority": { "value": "Atomicals ElectrumX reference indexer rules at the pinned revision", "status": "verified", "sourceId": "atomicals-electrumx-1.5.2.0", "sourceRevision": "8df23747835c20230fc8b8097d469e7a1d97c3e0", "verifiedAt": "2026-09-02" },
        "indexerRequirement": { "value": "An Atomicals indexer is required; no consensus-level validation exists", "status": "verified", "sourceId": "atomicals-electrumx-1.5.2.0", "sourceRevision": "8df23747835c20230fc8b8097d469e7a1d97c3e0", "verifiedAt": "2026-09-02" },
        "naming": { "value": "Realms, Subrealms, Containers, and Paynames with claim and rule mechanics", "status": "verified", "sourceId": "atomicals-electrumx-1.5.2.0", "sourceRevision": "8df23747835c20230fc8b8097d469e7a1d97c3e0", "verifiedAt": "2026-09-02" },
        "collections": { "value": "Containers with DMINT decentralized minting of items", "status": "verified", "sourceId": "atomicals-electrumx-1.5.2.0", "sourceRevision": "8df23747835c20230fc8b8097d469e7a1d97c3e0", "verifiedAt": "2026-09-02" },
        "programmability": { "value": "None in the base protocol; the AVM is a separate beta layer", "status": "verified", "sourceId": "atomicals-avm-interpreter", "sourceRevision": "c185e6216a3ea2cb2e011e508033ca535ece3472", "verifiedAt": "2026-09-02" },
        "contentPermanence": { "value": "Envelope and metadata content lives in confirmed witness data and is permanent", "status": "verified", "sourceId": "atomicals-electrumx-1.5.2.0", "sourceRevision": "8df23747835c20230fc8b8097d469e7a1d97c3e0", "verifiedAt": "2026-09-02" },
        "confirmationBehavior": { "value": "A reveal must confirm for the object to exist; a reorganization can unsettle unconfirmed assignments", "status": "verified", "sourceId": "atomicals-electrumx-1.5.2.0", "sourceRevision": "8df23747835c20230fc8b8097d469e7a1d97c3e0", "verifiedAt": "2026-09-02" },
        "principalUtxoRisk": { "value": "Spending an asset-bearing UTXO as a fee or change input permanently burns the carried asset", "status": "verified", "sourceId": "atomicals-electrumx-1.5.2.0", "sourceRevision": "8df23747835c20230fc8b8097d469e7a1d97c3e0", "verifiedAt": "2026-09-02" },
        "activationStatus": { "value": "Active on mainnet; per-feature activation boundaries live in the reference source", "status": "verified", "sourceId": "atomicals-electrumx-1.5.2.0", "sourceRevision": "8df23747835c20230fc8b8097d469e7a1d97c3e0", "verifiedAt": "2026-09-02", "notes": "Exact activation heights are in the networkActivations path of the pinned source." },
        "canonicalSource": { "value": "atomicals-electrumx-1.5.2.0", "status": "verified", "sourceId": "atomicals-electrumx-1.5.2.0", "sourceRevision": "8df23747835c20230fc8b8097d469e7a1d97c3e0", "verifiedAt": "2026-09-02" },
        "sourceRevision": { "value": "8df23747835c20230fc8b8097d469e7a1d97c3e0 (v1.5.2.0)", "status": "verified", "sourceId": "atomicals-electrumx-1.5.2.0", "sourceRevision": "8df23747835c20230fc8b8097d469e7a1d97c3e0", "verifiedAt": "2026-09-02" }
      }
    },
    {
      "id": "arc-20",
      "name": "ARC-20",
      "family": "atomicals-family",
      "summary": "The Atomicals fungible token model: one unit is one coloured satoshi, moved by ordinary Bitcoin spends under deterministic allocation rules.",
      "attributes": {
        "chain": { "value": "Bitcoin layer 1, mainnet", "status": "verified", "sourceId": "atomicals-electrumx-1.5.2.0", "sourceRevision": "8df23747835c20230fc8b8097d469e7a1d97c3e0", "verifiedAt": "2026-09-02" },
        "unitModel": { "value": "One unit is one coloured satoshi; balances emerge from which UTXOs a wallet holds", "status": "verified", "sourceId": "atomicals-electrumx-1.5.2.0", "sourceRevision": "8df23747835c20230fc8b8097d469e7a1d97c3e0", "verifiedAt": "2026-09-02" },
        "fungibleSupport": { "value": "Yes. Fixed and perpetual supply modes, decentralized and direct deployment", "status": "verified", "sourceId": "atomicals-electrumx-1.5.2.0", "sourceRevision": "8df23747835c20230fc8b8097d469e7a1d97c3e0", "verifiedAt": "2026-09-02" },
        "nonFungibleSupport": { "value": "No. NFTs belong to the wider Atomicals model, not to ARC-20 itself", "status": "verified", "sourceId": "atomicals-electrumx-1.5.2.0", "sourceRevision": "8df23747835c20230fc8b8097d469e7a1d97c3e0", "verifiedAt": "2026-09-02" },
        "mutability": { "value": "Deployment metadata and supply rules are immutable once deployed", "status": "verified", "sourceId": "atomicals-electrumx-1.5.2.0", "sourceRevision": "8df23747835c20230fc8b8097d469e7a1d97c3e0", "verifiedAt": "2026-09-02" },
        "stateLocation": { "value": "Indexer-computed holdings over UTXOs; no account ledger", "status": "verified", "sourceId": "atomicals-electrumx-1.5.2.0", "sourceRevision": "8df23747835c20230fc8b8097d469e7a1d97c3e0", "verifiedAt": "2026-09-02" },
        "dataPlacement": { "value": "Atom envelope in commit and reveal scripts; mint and transfer carry the ticker in the envelope", "status": "verified", "sourceId": "atomicals-electrumx-1.5.2.0", "sourceRevision": "8df23747835c20230fc8b8097d469e7a1d97c3e0", "verifiedAt": "2026-09-02" },